Time Point,Isla Nebular,GM - Isla Nebular,Isla Sorna,GM - Isla Sorna,Food,Scullery Wench
Thursday Evening,,,,,"Cracker barrel. Cheese, crackers, chips, dip, summer sausage",
Friday Morning,,,Princes of the Universe 2,James,"Bacon, eggs, bacon, hash browns, bacon, and toast/English muffins. And bacon.",
Friday Afternoon,,,,,Bratwurst on buns. Chips.,
Friday Evening,,,Princes of the Universe 2,James,"taco bar: shells, chips, meat, cheese, vegetables. Assemble your own.",
Saturday Morning,"It's a Mad, Mad, Mad, Mad (Lib) Q",Michael,-,,"Bacon, eggs, bacon, hash browns, bacon, and toast/English muffins. And bacon.",
Saturday Afternoon,,,Princes of the Universe 2,James,Cold cut sandwiches? Or a repeat of the bratwursts?,Bill
Saturday Evening,The Deplorable Word,Robb,-,,"blueberry chicken salad. Blueberries, blue cheese, lettuce, onions, oil and vinegar dressing, and sourdough bread.",Eric
Sunday Morning,Clean Up,,Clean Up,,"Leftovers of whatever, plus cold cereal.",